{"artifact_metadata":{"classification":"SYNTHETIC_FIXTURE","evidence_claim":"NOT_EVIDENCE_OR_PASS","fixture_notice":"SYNTHETIC EXAMPLE ONLY; NOT EVIDENCE; NOT A PASS VERDICT"},"body":{"base_core_input_projection_sha256":"77b033d1adc6843ebf44f6264f13f035f38b266e4b70174d1c584ae7e5f10fa0","candidate_id":"fixture-target-candidate-001","component_impact_graph_sha256":"cb72b115b0c8d471aa4f71b3702387d46478a09e6393ee1bfb6140ce211876c1","contract_release_sha256":"ffeaf17fa88b81525de8bbffbfeaaff15900ea3661742d9b2eec086ef2f12300","m3_binding_context_sha256":"520dde8bb4c6a9f5362e632516491c6af1289e8158f9328a6be7f11ffedabe61","predecessor_candidate_id":"fixture-base-candidate-001","product_assembly_sha256":"a977c8e2e444b090345dc2ad45452b10e53b13f779c7ad6666dee6fe5d4dd7de","product_contract_sha256":"fac531853410276fe9ebca29c631a9215222a84642df67e21ec70d2ca820ae11","qualification_bundle_sha256":"15e31e11f22b8770f64242e249eba9b9d0e704f0d7bef54d93f48d24f2aa0f3b","qualification_governance_contract_sha256":"6c7c2518f163fa3883c22d2bb77fc57d4d10799b5cd1e50862eaf2e11da5a39e","qualification_input_sha256_by_id":{"data-partition":"5bfdb7fa2ac9256ffaddb79c547ff0f344125c9bf1c449b86c4bb68819fa9508","procedure":"c11e9c7ac83900e101c337d321f1050d8cd93c3e6de332da828eb2a3b7ba424d","qualification-plan":"e2cc07153952499c61fae73c0aa78b07d91c8f559a25d72cd2c84e1d25066ba5","repetition-policy":"1e3adf4e753441b710d9bc544daa716bf57212a9ae46cf2ea206db8f4e5a273a","statistical-method":"cb0292e8490e5c8071f9b00b4c786389edf902b00afdb52f658c674ecbadc90d","support-cell":"8c6673a33fda1086b3124180b4c0b49b29432af9a366ebb8772c3793a8ffc8ec","threshold":"352c83240dbf51a9426fec27f89a15e72d1e674f9288a3802865539f0f8a24a2"},"qualification_plan_sha256":"e2cc07153952499c61fae73c0aa78b07d91c8f559a25d72cd2c84e1d25066ba5","qualification_revision":1,"rendered_config_sha256":"5184587a41961f79f2510797795df116fc1c86bc38f7c5cc231d8b219c3cf106"},"context_id":"fixture-binding-context-m4-source","created_at":"2026-06-01T12:00:00Z","lineage":{"baseline_refs":[{"artifact_id":"fixture-baseline","artifact_sha256":"c56c6f2124604457131e8a75d27c5d34c05f40be43586cf70666a3688f5059ed"}],"decision_refs":[{"artifact_id":"fixture-decision","artifact_sha256":"a3979f1dacdbcc879bda5a5fb7b9b17bfb97e0b647b583e45e4da63d5176c9ae"}]},"owner_role":"build-platform-owner","reviewer_role":"qa-evidence-owner","schema":"ylx.binding-context.v1","stage":"M4"}